{
  "schemaVersion": "creator-kit-bundle.v1",
  "name": "Spectoda Creator Kit",
  "version": "0.1.0",
  "status": "candidate",
  "locale": "en",
  "contentScope": "licensed-documentation-with-public-examples",
  "sourceOfTruth": "Spectoda/documentation",
  "transport": {
    "apiVersion": "github-release-v1",
    "stableChannelDescriptor": "stable-channel.json"
  }
}
